{
  "$schema": "https://json-schema.org/draft/2020-12/schema",
  "$id": "pur-new/agent_recommendation.schema.json",
  "title": "Frozen pre-result Agent recommendation",
  "description": "Immutable recommendation record created before physical result inspection whenever a prospective claim is intended. Experimental outcomes are stored separately using experiment_adjudication.schema.json.",
  "type": "object",
  "additionalProperties": false,
  "required": [
    "recommendation_id",
    "created_utc",
    "record_status",
    "result_inspection_status_at_creation",
    "decision_mode",
    "selected_candidate",
    "uncertainty",
    "selection_rationale",
    "acceptance_criterion",
    "provenance"
  ],
  "properties": {
    "recommendation_id": {"type": "string", "minLength": 1},
    "created_utc": {"type": "string", "minLength": 1},
    "record_status": {"enum": ["draft", "frozen"]},
    "result_inspection_status_at_creation": {
      "enum": ["no_results_inspected", "some_results_inspected", "unknown"]
    },
    "decision_mode": {
      "enum": ["performance_candidate", "robustness_probe", "uncertainty_probe", "abstain"]
    },
    "selected_candidate": {
      "type": ["object", "null"],
      "additionalProperties": false,
      "properties": {
        "candidate_id": {"type": ["string", "null"]},
        "formulation_state": {
          "type": ["object", "null"],
          "additionalProperties": true,
          "description": "Exact formulation recommended by the Agent. Preserve source units / parts."
        },
        "process_state": {
          "type": ["object", "null"],
          "additionalProperties": true,
          "description": "Reaction history, hold temperature/time, preparation state and other process variables known at recommendation time. Unknown fields remain null."
        },
        "measurement_plan": {
          "type": ["object", "null"],
          "additionalProperties": true,
          "description": "The measurement window/condition against which the recommendation will later be adjudicated."
        }
      }
    },
    "alternatives_considered": {
      "type": "array",
      "items": {
        "type": "object",
        "additionalProperties": false,
        "required": ["candidate_id"],
        "properties": {
          "candidate_id": {"type": "string"},
          "relative_reason": {"type": ["string", "null"]},
          "acquisition_value": {"type": ["number", "null"]}
        }
      }
    },
    "constraints": {
      "type": "array",
      "items": {
        "type": "object",
        "additionalProperties": false,
        "required": ["name", "status"],
        "properties": {
          "name": {"type": "string"},
          "status": {"enum": ["pass", "fail", "unknown"]},
          "detail": {"type": ["string", "null"]}
        }
      }
    },
    "uncertainty": {
      "type": "object",
      "additionalProperties": false,
      "required": [
        "measurement",
        "repeatability",
        "process_history",
        "extrapolation",
        "evidence_coverage"
      ],
      "properties": {
        "measurement": {"$ref": "#/$defs/uncertainty_component"},
        "repeatability": {"$ref": "#/$defs/uncertainty_component"},
        "process_history": {"$ref": "#/$defs/uncertainty_component"},
        "extrapolation": {"$ref": "#/$defs/uncertainty_component"},
        "evidence_coverage": {"$ref": "#/$defs/uncertainty_component"},
        "aggregate_penalty": {"type": ["number", "null"]},
        "aggregation_rule": {"type": ["string", "null"]},
        "decision_margin": {"type": ["number", "null"]}
      }
    },
    "selection_rationale": {"type": "string", "minLength": 1},
    "acceptance_criterion": {
      "type": "object",
      "additionalProperties": false,
      "required": ["claim", "criterion"],
      "properties": {
        "claim": {"type": "string", "minLength": 1},
        "criterion": {"type": "string", "minLength": 1},
        "measurement_window": {"type": ["string", "null"]},
        "failure_condition": {"type": ["string", "null"]}
      }
    },
    "provenance": {
      "type": "object",
      "additionalProperties": false,
      "required": ["generated_by"],
      "properties": {
        "generated_by": {"enum": ["agent", "human", "hybrid"]},
        "git_commit": {"type": ["string", "null"]},
        "run_id": {"type": ["string", "null"]},
        "model": {"type": ["string", "null"]},
        "prompt_hash": {"type": ["string", "null"]},
        "input_hash": {"type": ["string", "null"]},
        "workflow_version": {"type": ["string", "null"]}
      }
    }
  },
  "$defs": {
    "uncertainty_component": {
      "type": "object",
      "additionalProperties": false,
      "required": ["status"],
      "properties": {
        "status": {"enum": ["known", "estimated", "unknown", "not_applicable"]},
        "value": {"type": ["number", "null"]},
        "unit_or_scale": {"type": ["string", "null"]},
        "method": {"type": ["string", "null"]},
        "note": {"type": ["string", "null"]}
      }
    }
  }
}
