{
  "acceptance_criterion": {
    "claim": "Proceed to a bounded full-coverage performance experiment only when the candidate formulation and its comparison are interpretable with respect to stoichiometry, process state, and realization spread.",
    "criterion": "Before physical adjudication, verify modifier identity, equivalent weight, reactive functionality, formulation denominator, and recalculated NCO:OH; prepare the candidate and an E2/reactive-core control contemporaneously under identical documented processing; predeclare independent preparation count, blocking or randomization, technical replicate structure, numerical SI15-60 and SI15-90 improvement limits, processable viscosity limits, temperature-response limits, and allowable state-calibration error.",
    "failure_condition": "Fail to advance the performance claim if stoichiometry or process history cannot be verified, the matched control is absent, acceptance limits are not frozen before testing, hold data are incomplete or temperature-confounded, or candidate differences cannot be distinguished from realization spread.",
    "measurement_window": "For the subsequent performance test: matched 120 C hold at 15, 60, and 90 min, plus an 80-130 C temperature sweep with a 120 C state anchor."
  },
  "alternatives_considered": [
    {
      "acquisition_value": null,
      "candidate_id": "S1C41",
      "relative_reason": "Provisional minimum-burden full-coverage performance candidate: 15 wt% acrylic-like modifier plus 5 wt% minor tackifier-like modifier on the E2 reactive core. It is not selected because the 15 wt% acrylic evidence is directional/noncommensurate and matched-control, stoichiometric, replication, and numerical acceptance requirements remain unresolved."
    },
    {
      "acquisition_value": null,
      "candidate_id": "S1C46",
      "relative_reason": "Full-coverage compromise with 17.5 wt% acrylic-like modifier and 5 wt% tackifier-like modifier; more conservative with respect to the supported acrylic region than S1C41 but with greater modifier burden and the same unresolved process-state and stoichiometric uncertainties."
    },
    {
      "acquisition_value": null,
      "candidate_id": "S1C51",
      "relative_reason": "Most conservative full-coverage composition if directly commensurate approximately 20 wt% acrylic evidence is prioritized, but its 25 wt% total modifier burden increases processability and state-confounding risk."
    },
    {
      "acquisition_value": null,
      "candidate_id": "S1C11",
      "relative_reason": "Useful tackifier-only mechanistic control at 5 wt%, but inappropriate as the primary performance-mitigation experiment because it zeroes an independently supported acrylic-like axis."
    },
    {
      "acquisition_value": null,
      "candidate_id": "S1C39",
      "relative_reason": "Useful acrylic-only mechanistic control, but inappropriate as the primary performance-mitigation experiment because it zeroes an independently supported minor-tackifier-like axis."
    }
  ],
  "constraints": [
    {
      "detail": "The established failure mode is thermal-hold viscosity drift at 120 C, with E5 SI values of 0.515 from 15-60 min and 0.931 from 15-90 min versus much smaller E1 drift.",
      "name": "Failure-mode alignment",
      "status": "pass"
    },
    {
      "detail": "The declared intent is performance_mitigation, for which independently supported acrylic-like and minor-tackifier-like axes may be combined.",
      "name": "Experiment intent",
      "status": "pass"
    },
    {
      "detail": "A primary mitigation candidate must cover both independently supported axes; single-axis candidates remain mechanistic controls only.",
      "name": "Required intervention-axis coverage",
      "status": "pass"
    },
    {
      "detail": "A paired or blocked E2/reactive-core control prepared and processed identically has not yet been committed.",
      "name": "Matched contemporaneous control",
      "status": "unknown"
    },
    {
      "detail": "Modifier identity, equivalent weight, reactive-group functionality, denominator, and recalculated NCO:OH balance are not supplied.",
      "name": "Stoichiometric interpretability",
      "status": "unknown"
    },
    {
      "detail": "The local state-aware model supports one-point calibration within the original chemistry family, but applicability to dual-modifier chemistry must be tested rather than assumed.",
      "name": "State calibration",
      "status": "unknown"
    },
    {
      "detail": "Any performance test must measure viscosity at 120 C at 15, 60, and 90 min and include the 80-130 C temperature sweep.",
      "name": "Matched thermal-hold measurement",
      "status": "pass"
    },
    {
      "detail": "Numerical limits for improvement beyond realization spread, processable viscosity, temperature response, replication, and allowable calibration error are not frozen.",
      "name": "Operational acceptance limits",
      "status": "unknown"
    },
    {
      "detail": "Six major process-history fields are missing in the candidate records, and E2 has substantial realization spread.",
      "name": "Process-history completeness",
      "status": "fail"
    },
    {
      "detail": "External PUR literature supports formulation families and broad regions only; it is not treated as a direct predictor or exact optimum.",
      "name": "External-evidence use",
      "status": "pass"
    }
  ],
  "created_utc": "2026-09-18T09:49:15Z",
  "decision_mode": "abstain",
  "provenance": {
    "generated_by": "agent",
    "git_commit": "662297bf1fd065c0d628ac052880a531d4ef1200",
    "input_hash": "757c029738d85d3e3a8c6ac27725aa8bd24814c891abca510851ef0b9fef512c",
    "model": "gpt-5.6-luna",
    "prompt_hash": "2081d3bfbf0571474c95e3d65834eea23cff2942b99c1aa6e76aaa57f3cea04c",
    "run_id": "REC_V3_20260918T094915Z_0f3663a258",
    "workflow_version": "1.2.0;agent_v3=3.4.0"
  },
  "recommendation_id": "REC_V3_20260918T094915Z_0f3663a258",
  "record_status": "frozen",
  "result_inspection_status_at_creation": "no_results_inspected",
  "selected_candidate": null,
  "selection_rationale": "The measured local experiments establish thermal-hold instability as the failure mode, distinguish it from temperature-dependent viscosity level, and show large E2 realization spread. The paper-derived rheological rule is that process and realization state primarily shift viscosity scale while a transferable thermal-response shape can be used with a one-point in-range state anchor, but that rule is demonstrated only within the original local chemistry family. Curated PUR literature supports an acrylic-like plus minor-tackifier-like formulation family and broad regions, not an exact local property prediction or optimum. The conservative design constraint for performance mitigation requires retaining both independently supported intervention axes; minimum modifier burden can be used only among otherwise sufficient candidates. The Skeptic objection is decisive that S1C41's 15 wt% acrylic level is only directionally supported, that matched control and numerical acceptance rules are missing, and that modifier functionality may change stoichiometry. The Robustness Adjudicator likewise found process-state and stoichiometric interpretability failures and conditionally preferred S1C51 only if the 15 wt% acrylic evidence is discounted. Therefore no formulation is frozen as the performance result yet. The uncertainty probe must first verify modifier specifications and recalculated stoichiometry, add a contemporaneous identically processed E2/reactive-core control, freeze replication/blocking and numerical acceptance limits, and record complete process history. After those conditions are satisfied, S1C41 remains the lower-burden full-coverage candidate, while S1C51 is the conservative alternative if directly commensurate acrylic-region evidence is required.",
  "uncertainty": {
    "aggregate_penalty": null,
    "aggregation_rule": "scientific multi-stage adjudication",
    "decision_margin": null,
    "evidence_coverage": {
      "method": "Curated PUR literature and local E2 anchor",
      "note": "Acrylic-like support spans a broad 15-25 wt% region with 15 wt% directional and approximately 20-25 wt% more directly commensurate evidence; minor tackifier-like support centers near 5 wt% and remains below about 10 wt%.",
      "status": "estimated",
      "unit_or_scale": "formulation region",
      "value": null
    },
    "extrapolation": {
      "method": "State-aware local rheology summary",
      "note": "The state-shift/shared-shape result is strong within the measured local family but is not validated for dual-modifier chemistry.",
      "status": "estimated",
      "unit_or_scale": "chemistry-family applicability",
      "value": null
    },
    "measurement": {
      "method": "120 C hold at 15, 60, and 90 min plus 80-130 C temperature sweep",
      "note": "The required measurement window is established, but candidate-specific measurements do not exist.",
      "status": "known",
      "unit_or_scale": "measurement design",
      "value": null
    },
    "process_history": {
      "method": null,
      "note": "Preparation, mixing, drying, storage, sample-age, and thermal-history linkage is incomplete.",
      "status": "unknown",
      "unit_or_scale": null,
      "value": null
    },
    "repeatability": {
      "method": "Original E2 realization data",
      "note": "E2 showed approximate CV 0.46-0.58 and maximum/minimum ratios of approximately 2.8-3.6; independent preparation count for the next experiment is not frozen.",
      "status": "estimated",
      "unit_or_scale": "descriptive spread",
      "value": null
    }
  }
}
