{
  "acceptance_criterion": {
    "claim": "S1C49 provides an interpretable test of whether a 20 wt% acrylic-like intervention changes 120 C thermal-hold drift relative to the matched E2 reactive-core reference, without attributing a result to composition when realization state or stoichiometry is uncontrolled.",
    "criterion": "Before physical adjudication, require verified AC1920 reactive functionality and recalculated stoichiometry; at least two independently prepared S1C49 samples and matched E2 references; recorded and matched process history; viscosity measurements at 0, 15, 60, and 90 min during a 120 C hold; SI lower than the matched E2 reference at both 15-60 and 15-90 min in the same directional sense across independent preparations; monotonic viscosity decrease across the measured 80-130 C sweep; and no visible phase separation, gelation, or other macroscopic instability. Report initial viscosity, absolute hold loss, replicate dispersion, and preserved source units.",
    "failure_condition": "Fail or defer interpretation if AC1920 functionality or stoichiometry cannot be verified, required process history is not matched, either hold-window SI is not lower than the matched E2 reference in the consistent independent-preparation direction, temperature response is not monotonic within 80-130 C, replicate directions disagree without a resolvable state explanation, or visible phase separation, gelation, or other macroscopic instability occurs.",
    "measurement_window": "80-130 C temperature sweep and 120 C hold at 0, 15, 60, and 90 min, with SI reported for 15-60 and 15-90 min under matched conditioning and thermal history."
  },
  "alternatives_considered": [
    {
      "acquisition_value": null,
      "candidate_id": "S1C59",
      "relative_reason": "Stronger acrylic-region performance test and deterministic evidence-first leader, but its 25 wt% loading has greater unresolved stoichiometric, compatibility, and process-state risk."
    },
    {
      "acquisition_value": null,
      "candidate_id": "S1C11",
      "relative_reason": "Conservative 5 wt% tackifier-like probe with independent intervention direction, but less directly connected to the acrylic-region hypothesis and with unresolved compatibility risk."
    },
    {
      "acquisition_value": null,
      "candidate_id": "S1C61",
      "relative_reason": "Combined acrylic-like and tackifier-like intervention, but simultaneous changes reduce attribution and increase stoichiometric and compatibility uncertainty."
    },
    {
      "acquisition_value": null,
      "candidate_id": "S1C05",
      "relative_reason": "Measured reactive-core-only reference-region formulation and useful matched control, but it does not test the modifier-family intervention."
    }
  ],
  "constraints": [
    {
      "detail": "S1C49 preserves the E2 relative MDI/PDP70/PPG2000 proportions while replacing 20 wt% of the total formulation with AC1920.",
      "name": "Matched E2 reactive-core reference",
      "status": "pass"
    },
    {
      "detail": "Verify reactive-group content and equivalent weight before preparation; recalculate the actual NCO:reactive-group balance if AC1920 contributes reactive groups.",
      "name": "AC1920 reactive functionality and stoichiometry",
      "status": "unknown"
    },
    {
      "detail": "Six major process-history fields are missing and local E2 repeat spread is large; preparation, mixing, reaction, conditioning, aging, thermal history, operator, and instrument conditions must be recorded and matched.",
      "name": "Process and realization-state control",
      "status": "fail"
    },
    {
      "detail": "Use a matched 120 C initial-viscosity anchor to locate the realization on the local rheological response shape, but do not use that anchor as a substitute for direct hold measurements.",
      "name": "State anchor",
      "status": "pass"
    },
    {
      "detail": "Restrict the temperature sweep to 80-130 C and measure the 120 C hold at 0, 15, 60, and 90 min.",
      "name": "Supported temperature and hold windows",
      "status": "pass"
    },
    {
      "detail": "The approximately 20 wt% acrylic region is a curated analogue prior supporting a formulation family and coarse region, not a predictor of S1C49 properties or an exact optimum.",
      "name": "External evidence boundary",
      "status": "pass"
    },
    {
      "detail": "Interpretability requires independent preparations of S1C49 and concurrently prepared E2 references under identical history, plus direct hold measurements and visible-instability observations.",
      "name": "Interpretability of the uncertainty probe",
      "status": "unknown"
    }
  ],
  "created_utc": "2026-09-18T07:30:45Z",
  "decision_mode": "uncertainty_probe",
  "provenance": {
    "generated_by": "agent",
    "git_commit": "a6f61f54a2d577452fa865e18ef6b60cf08364ec",
    "input_hash": "18506ef6c33c743c12845eff7433e78c708374b00b0d0818f027a6577d1ec32c",
    "model": "gpt-5.6-luna",
    "prompt_hash": "69fedc5433bead6d260facdbd838e5f1750824f0776724c8736aebc123dbfaa4",
    "run_id": "REC_V3_20260918T073045Z_ef6c462a52",
    "workflow_version": "1.2.0;agent_v3=3.3.1"
  },
  "recommendation_id": "REC_V3_20260918T073045Z_ef6c462a52",
  "record_status": "frozen",
  "result_inspection_status_at_creation": "no_results_inspected",
  "selected_candidate": {
    "candidate_id": "S1C49",
    "formulation_state": {
      "AC1920": 20.0,
      "MDI": 16.1525384179,
      "PDP70": 31.923730791,
      "PPG2000": 31.923730791,
      "TK100": 0.0,
      "amount_basis": "normalized_total_wt_percent",
      "design_layer": "uniform_modifier_lattice_on_E2_core"
    },
    "measurement_plan": null,
    "process_state": {
      "hold_temperature_c": null,
      "hold_time_min": null,
      "mixing_history": null,
      "reaction_temperature_c": null,
      "reaction_time_min": null,
      "sample_age": null
    }
  },
  "selection_rationale": "S1C49 is selected as an uncertainty probe rather than as a predicted optimum. Local experiments establish monotonic viscosity decrease over 80-130 C, large realization spread, and a distinct formulation-dependent thermal-hold failure mode: E1 is substantially more stable than E5. The state-aware rheology analysis shows that realization primarily shifts viscosity scale within the measured local chemistry family, so a matched 120 C anchor is useful, but it does not establish that the temporal hold-drift coordinate is invariant. Paper-derived rheological rules therefore require state anchoring and direct hold measurement, not static-viscosity substitution. Curated PUR literature/database priors support an acrylic-like intervention region near 20 wt%, but they are analogue evidence and do not predict S1C49 performance. The conservative design constraint is to preserve E2 reactive-core proportions, verify AC1920 functionality and stoichiometry, prepare S1C49 and E2 concurrently with matched history, and measure the complete 120 C hold. S1C49 is preferred over S1C59 because its lower loading reduces unresolved compatibility and stoichiometric risk while retaining a clean acrylic-axis test; S1C11 and S1C61 are less direct or less attributable. The Skeptic's objections are resolved by treating the 120 C anchor only as a state diagnostic, requiring independent preparations and a matched E2 reference, and refusing causal or exact-property claims. The Robustness Adjudicator's fragile-ranking objection and failed diagnostic calls are resolved by changing the mode from performance candidate to uncertainty probe rather than relying on the deterministic ranking.",
  "uncertainty": {
    "aggregate_penalty": null,
    "aggregation_rule": "scientific multi-stage adjudication",
    "decision_margin": null,
    "evidence_coverage": {
      "method": "Combine local rheology and hold evidence with curated analogue formulation evidence.",
      "note": "Local evidence supports the failure mode and state-control design; external evidence supports only a coarse formulation region. Hold, repeatability, temperature-support, and external-prior diagnostics were incomplete.",
      "status": "estimated",
      "unit_or_scale": "partial",
      "value": null
    },
    "extrapolation": {
      "method": "Compare the 20 wt% acrylic-like intervention with matched E2 under the measured 80-130 C and 15-90 min windows.",
      "note": "The composition is supported by analogue anchors, but transfer to AC1920 in this reactive core is unproven.",
      "status": "estimated",
      "unit_or_scale": "moderate formulation extrapolation; no temperature or hold-window extrapolation",
      "value": null
    },
    "measurement": {
      "method": "Initial viscosity and 80-130 C sweep; 120 C hold at 0, 15, 60, and 90 min; calculate SI at 15-60 and 15-90 min.",
      "note": "Absolute viscosity thresholds are not imposed because source units and a validated external threshold are unavailable.",
      "status": "known",
      "unit_or_scale": "preserved source viscosity units; SI dimensionless",
      "value": null
    },
    "process_history": {
      "method": "Record and match preparation, mixing, reaction, conditioning, aging, sample-age, thermal-history, operator, and instrument fields.",
      "note": "Six major process-history fields are missing for the candidate space.",
      "status": "unknown",
      "unit_or_scale": null,
      "value": null
    },
    "repeatability": {
      "method": "Use independent preparations and within-preparation replicate measurements with pre-registered aggregation.",
      "note": "Local E2 sample CV is approximately 0.46-0.58 with maximum-to-minimum ratios approximately 2.8-3.6.",
      "status": "estimated",
      "unit_or_scale": "high qualitative risk",
      "value": null
    }
  }
}
