{
  "acceptance_criterion": {
    "claim": "S1C41 mitigates the established 120 C thermal-hold failure rather than merely changing the initial viscosity.",
    "criterion": "Using at least three nominally comparable S1C41 realizations and a matched E2-like or process-matched baseline, with complete process history recorded and a 120 C state anchor within the supplied one-point calibration error range, the candidate mean SI must be lower than the original E5 reference in both the 15-60 min and 15-90 min windows. The reduction must also exceed the pre-specified replicate/process-state spread of the matched baseline. All scheduled temperature-sweep and hold measurements must remain valid and processable across 80-130 C.",
    "failure_condition": "Fail the performance claim if either SI window is not lower than the E5 reference, if the candidate-baseline difference does not exceed the measured matched-baseline/process-state spread, if the 120 C state anchor cannot be calibrated within the supplied error range, if fewer than three interpretable comparable realizations are available, or if any required result is outside the supported temperature/time window or non-processable.",
    "measurement_window": "Temperature sweep over 80-130 C; matched 120 C hold over 15-90 min with readings at 15, 60, and 90 min; report SI for 15-60 min and 15-90 min."
  },
  "alternatives_considered": [
    {
      "acquisition_value": null,
      "candidate_id": "S1C40",
      "relative_reason": "Full dual-axis coverage with lower modifier burden, but its 2.5% tackifier loading is below the directly supported 4.8-6.4% cluster; a null result would confound ineffective chemistry with insufficient loading."
    },
    {
      "acquisition_value": null,
      "candidate_id": "S1C45",
      "relative_reason": "Full dual-axis coverage with stronger acrylic loading, but it imposes a higher total modifier burden and greater potential viscosity or process-state confounding than S1C41."
    },
    {
      "acquisition_value": null,
      "candidate_id": "S1C10",
      "relative_reason": "Useful minor-tackifier mechanistic control, but it zeroes the independently supported acrylic-like axis and therefore does not constitute the default performance-mitigation experiment."
    }
  ],
  "constraints": [
    {
      "detail": "The established failure is excessive viscosity increase during a 120 C hold; S1C41 will be evaluated by matched 15-60 min and 15-90 min hold trajectories.",
      "name": "Failure-mode alignment",
      "status": "pass"
    },
    {
      "detail": "S1C41 covers both independently supported axes: 15% acrylic-like modifier and 5% minor-tackifier-like modifier.",
      "name": "Performance-mitigation axis coverage",
      "status": "pass"
    },
    {
      "detail": "The E2 reactive-core proportions are preserved while the modifier axes are introduced.",
      "name": "Local reactive-core preservation",
      "status": "pass"
    },
    {
      "detail": "The acrylic level is within the supported 15-25% coarse region and the tackifier level lies in the repeated approximately 4.8-6.4% cluster; these priors support a region, not an exact property prediction.",
      "name": "External evidence region",
      "status": "pass"
    },
    {
      "detail": "Evaluation is restricted to the measured 80-130 C temperature range and 15-90 min hold window.",
      "name": "Temperature and hold-time support",
      "status": "pass"
    },
    {
      "detail": "A state-specific 120 C anchor is required; acceptability must be assessed against the supplied pooled one-point calibration error range of approximately 1.063-1.099 multiplicative error.",
      "name": "State calibration",
      "status": "unknown"
    },
    {
      "detail": "The supplied E2 repeatability risk is high, including CV up to 0.5848 and a 120 C max/min ratio of 3.5688; at least three comparable runs with complete process-history records are required before adjudication.",
      "name": "Repeatability and process history",
      "status": "fail"
    },
    {
      "detail": "The original E5 trajectory is a single run; a matched E2-like or process-matched baseline replicate must be measured alongside S1C41.",
      "name": "Matched baseline comparison",
      "status": "unknown"
    },
    {
      "detail": "Modifier reactive-group density, stoichiometric contribution, identity, and thermal-conditioning history must be verified and recorded.",
      "name": "Modifier stoichiometry and functionality",
      "status": "unknown"
    }
  ],
  "created_utc": "2026-09-18T09:05:25Z",
  "decision_mode": "performance_candidate",
  "provenance": {
    "generated_by": "agent",
    "git_commit": "662297bf1fd065c0d628ac052880a531d4ef1200",
    "input_hash": "3359b65715a969e3c2b7e11f6d5aaad6b606e29a8eb00e283df1afee2524a376",
    "model": "gpt-5.6-luna",
    "prompt_hash": "2081d3bfbf0571474c95e3d65834eea23cff2942b99c1aa6e76aaa57f3cea04c",
    "run_id": "REC_V3_20260918T090525Z_8b8d2b40ec",
    "workflow_version": "1.2.0;agent_v3=3.4.0"
  },
  "recommendation_id": "REC_V3_20260918T090525Z_8b8d2b40ec",
  "record_status": "frozen",
  "result_inspection_status_at_creation": "no_results_inspected",
  "selected_candidate": {
    "candidate_id": "S1C41",
    "formulation_state": {
      "AC1920": 15.0,
      "MDI": 16.1525384179,
      "PDP70": 31.923730791,
      "PPG2000": 31.923730791,
      "TK100": 5.0,
      "amount_basis": "normalized_total_wt_percent",
      "design_layer": "uniform_modifier_lattice_on_E2_core"
    },
    "measurement_plan": null,
    "process_state": {
      "hold_temperature_c": null,
      "hold_time_min": null,
      "mixing_history": null,
      "reaction_temperature_c": null,
      "reaction_time_min": null,
      "sample_age": null
    }
  },
  "selection_rationale": "The measured local experiments establish that the relevant failure is time-dependent viscosity growth during the 120 C hold, not merely an unfavorable static viscosity or temperature-response level: E5 has SI values of 0.515 over 15-60 min and 0.931 over 15-90 min, versus 0.095 and 0.168 for E1. The state-aware rheology analysis further shows that realization/process state primarily shifts viscosity scale, with one-point calibration giving approximately 1.063-1.099 pooled multiplicative error, so a 120 C state anchor and matched process-history control are mandatory. Paper-derived rheological rules support separating instantaneous temperature response from hold drift and measuring the full 15-90 min trajectory; they do not predict S1C41's result. Curated PUR literature/database priors support an acrylic-like intervention region of approximately 15-25% and a minor tackifier region centered near 5%, while providing only analogue and directional evidence rather than an exact optimum or molecular mechanism. S1C41 therefore provides the required full performance-mitigation coverage with both independently supported axes, while preserving the E2 reactive core. The conservative design constraint is to remain inside the supplied lattice, stay within the measured temperature and time windows, document modifier functionality and stoichiometry, use at least three comparable runs, and reject uncalibratable or non-processable realizations. The Skeptic objection is resolved by not selecting S1C40 solely for lower modifier burden: its 2.5% tackifier level is below the repeated supported cluster and would make a null result ambiguous. The Robustness Adjudicator objection is resolved by selecting S1C41 ahead of S1C40 while retaining S1C40 only as a possible exploratory low-loading sufficiency probe. This decision identifies an evidence-supported formulation region for experiment; it is not an exact-property prediction.",
  "uncertainty": {
    "aggregate_penalty": null,
    "aggregation_rule": "scientific multi-stage adjudication",
    "decision_margin": null,
    "evidence_coverage": {
      "method": "independent-axis coverage diagnostics and curated PUR literature/database priors",
      "note": "No direct local hold trajectory exists for the modifier combination.; model value text: full intervention coverage with moderate-to-strong analogue-region support",
      "status": "known",
      "unit_or_scale": null,
      "value": null
    },
    "extrapolation": {
      "method": "comparison with measured 80-130 C and 15-90 min support plus external analogue regions",
      "note": "The formulation family extends beyond the measured local reactive-only chemistry; external evidence supports direction and bounded composition regions only.",
      "status": "estimated",
      "unit_or_scale": "bounded region",
      "value": null
    },
    "measurement": {
      "method": "apparent temperature-sensitivity descriptor across six local realizations",
      "note": "Temperature-response shape is comparatively concentrated, but this does not establish hold-stability uncertainty.",
      "status": "estimated",
      "unit_or_scale": "coefficient of variation",
      "value": 0.057684500815895386
    },
    "process_history": {
      "method": null,
      "note": "Major preparation, mixing, reaction, conditioning, sample-age, and state fields are not supplied for the candidate.",
      "status": "unknown",
      "unit_or_scale": null,
      "value": null
    },
    "repeatability": {
      "method": "three E2 runs",
      "note": "The corresponding 120 C max/min ratio is 3.5688; this is a major interpretability limitation.",
      "status": "estimated",
      "unit_or_scale": "sample CV at 120 C",
      "value": 0.5848356762251301
    }
  }
}
